{
  "role": "target",
  "language": "zh",
  "version": "demo-draft-2",
  "units": [
    {"unit_id": "UNIT-DEMO-001", "text": "第1条 目的。北园议事会（North Orchard Council，简称 NOC）的本共用果园规则允许成员家庭采摘公共果树的果实，供自家食用。依本规则采摘的果实不得出售。"},
    {"unit_id": "UNIT-DEMO-002", "text": "第2条 成员。成员家庭是指已在议事会登记、并至少参加过一次春季种植的家庭。登记免费，可在任何一次例会上办理。"},
    {"unit_id": "UNIT-DEMO-003", "text": "第3条 公共果树。北园议事会保存公共果树清单，并为每棵公共果树系上绿色标带。未系标带的果树属于各家庭所有，不适用本规则。"},
    {"unit_id": "UNIT-DEMO-004", "text": "第4条 采摘时间。成员可在日出至日落之间采摘。成员不得使用可能损伤树枝的梯子或工具。"},
    {"unit_id": "UNIT-DEMO-005", "text": "第5条 损坏报告。成员发现果树受损的，应在14日内向议事会报告。报告可以口头或书面形式提出。"},
    {"unit_id": "UNIT-DEMO-006", "text": "第6条 共用工具。北园议事会应将共用工具存放在工具棚内，并按申请先后出借。借出的工具应在下次例会前归还。"},
    {"unit_id": "UNIT-DEMO-007", "text": "第7条 采收日。主采收期开始前，议事会应在例会上公布采收日。采收日内，各家庭只采摘分配给本家庭的果树。"},
    {"unit_id": "UNIT-DEMO-008", "text": "第8条 剩余果实。采收日结束后剩余的果实，应先提供给有幼儿的家庭，再提供给邻近学校。"},
    {"unit_id": "UNIT-DEMO-009", "text": "第9条 违约。违反第1条出售果实的家庭，应缴纳1250果园积分的罚款，并可被暂停采摘资格至本季结束。"},
    {"unit_id": "UNIT-DEMO-010", "text": "第10条 申诉。家庭可以对罚款或暂停决定提出申诉。北园议事会应在下次例会上听取申诉，并以书面形式作出决定。"},
    {"unit_id": "UNIT-DEMO-011", "text": "第11条 记录。议事会应保存每次例会的会议记录，包括公共果树清单、采收日和全部申诉决定。"},
    {"unit_id": "UNIT-DEMO-012", "text": "第12条 修订。对本规则的任何修改，须经成员家庭在例会上以过半数同意。北园议事会应将修订后的文本张贴在公告栏。"}
  ],
  "synthetic": true
}
